python write data to netcdf file,<case:lower>import arviz as az<newline>data = az.load_arviz_data('centered_eight')<newline>data.to_netcdf('eight_schools_model.nc')
python load netCDF file,<case:lower>import xarray as xr<newline>ds_disk = xr.open_dataset('saved_on_disk.nc')
python make traceplot of negative binomial,"<case:lower>import arviz as az<newline>import matplotlib.pyplot as plt<newline><case:normal>az.plot_trace(posterior, var_names=['mu', 'scale', 'dev'])<newline>plt.savefig('/Users/blaine/StanSandBox/ArvizTraceNBmuScaleDev.png')<newline>plt.close()"
python make pair plot,"<case:lower>import arviz as az<newline>import matplotlib.pyplot as plt<newline><case:normal>az.plot_joint(posterior, var_names=['mu', 'scale'], kind='hexbin')<newline>plt.savefig('/Users/blaine/StanSandBox/ArvizPairedNBmuScale.pdf')<newline>plt.close()"
python make posterior plot of negative binomial model,"<case:lower>import matplotlib.pyplot as plt<newline>az.plot_joint(posterior, var_names=['mu', 'scale'], kind='hexbin')<newline><case:normal>plt.savefig('/Users/blaine/StanSandBox/ArvizPosteriorNBmuScaleDev.pdf')<newline>plt.close()"
python make density plot,"<case:lower>import matplotlib.pyplot as plt<newline>import arviz as az<newline><newline>az.style.use("arviz-doc")<newline>centered_data = az.load_arviz_data("centered_eight")<newline>axes =az.plot_density(<newline>    [centered_data],<newline>    data_labels=["Centered"],<newline>    var_names=["theta"],<newline>    shade=0.2,<newline>)<newline><newline>fig = axes.flatten([0].get_figure()<newline><case:lower>fig.suptitle("94% High Density Intervals for Theta")<newline>plt.show()"
